{
  "$schema": "https://json-schema.org/draft/2020-12/schema",
  "$id": "https://raw.githubusercontent.com/shimpeiws/word-grain/main/schema/v0.2.0/wordgrain.schema.json",
  "title": "WordGrain",
  "description": "A JSON format for storing vocabulary data and lyric bar analysis extracted from musical lyrics.",
  "type": "object",
  "required": ["$schema", "schema_version", "meta"],
  "anyOf": [
    { "required": ["grains"] },
    { "required": ["bars"] }
  ],
  "additionalProperties": false,
  "properties": {
    "$schema": {
      "type": "string",
      "format": "uri",
      "description": "URI reference to the WordGrain schema version",
      "pattern": "^https://raw\\.githubusercontent\\.com/shimpeiws/word-grain/main/schema/v[0-9]+\\.[0-9]+\\.[0-9]+/wordgrain\\.schema\\.json$"
    },
    "schema_version": {
      "type": "string",
      "description": "Schema version identifier",
      "pattern": "^[0-9]+\\.[0-9]+\\.[0-9]+$",
      "examples": ["0.2.0"]
    },
    "meta": {
      "$ref": "#/$defs/Meta"
    },
    "grains": {
      "type": "array",
      "description": "Array of vocabulary grain entries",
      "items": {
        "$ref": "#/$defs/Grain"
      },
      "minItems": 0
    },
    "bars": {
      "type": "array",
      "description": "Array of lyric bar entries",
      "items": {
        "$ref": "#/$defs/Bar"
      },
      "minItems": 1
    }
  },
  "$defs": {
    "Meta": {
      "type": "object",
      "description": "Metadata about the WordGrain document",
      "required": ["source", "artist", "generated_at"],
      "additionalProperties": false,
      "properties": {
        "source": {
          "type": "string",
          "description": "Data source identifier (e.g., 'genius', 'azlyrics', 'manual')",
          "minLength": 1,
          "examples": ["genius", "azlyrics", "spotify", "manual"]
        },
        "artist": {
          "type": "string",
          "description": "Primary artist name",
          "minLength": 1
        },
        "artists": {
          "type": "array",
          "description": "Additional artists for collaborative corpora",
          "items": {
            "type": "string",
            "minLength": 1
          },
          "minItems": 1
        },
        "corpus_size": {
          "type": "integer",
          "description": "Number of tracks analyzed",
          "minimum": 0
        },
        "total_words": {
          "type": "integer",
          "description": "Total word count in analyzed corpus",
          "minimum": 0
        },
        "generated_at": {
          "type": "string",
          "format": "date-time",
          "description": "ISO 8601 timestamp of document generation"
        },
        "generator": {
          "type": "string",
          "description": "Tool or pipeline that generated this document",
          "examples": ["wordgrain-cli/1.0.0", "manual"]
        },
        "language": {
          "type": "string",
          "description": "ISO 639-1 language code",
          "pattern": "^[a-z]{2}$",
          "default": "en"
        },
        "description": {
          "type": "string",
          "description": "Human-readable description of this corpus"
        }
      }
    },
    "Grain": {
      "type": "object",
      "description": "A single vocabulary entry with linguistic and statistical data",
      "required": ["word"],
      "additionalProperties": false,
      "properties": {
        "word": {
          "type": "string",
          "description": "The vocabulary word or phrase",
          "minLength": 1
        },
        "normalized": {
          "type": "string",
          "description": "Normalized/lemmatized form of the word",
          "minLength": 1
        },
        "pos": {
          "type": "string",
          "description": "Part of speech tag",
          "enum": [
            "noun",
            "verb",
            "adjective",
            "adverb",
            "pronoun",
            "preposition",
            "conjunction",
            "interjection",
            "determiner",
            "particle",
            "other"
          ]
        },
        "frequency": {
          "type": "integer",
          "description": "Raw occurrence count in corpus",
          "minimum": 1
        },
        "frequency_normalized": {
          "type": "number",
          "description": "Frequency per 10,000 words",
          "minimum": 0
        },
        "tfidf": {
          "type": "number",
          "description": "TF-IDF score (0.0 to 1.0)",
          "minimum": 0,
          "maximum": 1
        },
        "sentiment": {
          "type": "string",
          "description": "Sentiment classification",
          "enum": ["positive", "negative", "neutral", "mixed"]
        },
        "sentiment_score": {
          "type": "number",
          "description": "Sentiment score (-1.0 to 1.0)",
          "minimum": -1,
          "maximum": 1
        },
        "categories": {
          "type": "array",
          "description": "Semantic categories or tags",
          "items": {
            "type": "string",
            "minLength": 1
          },
          "uniqueItems": true
        },
        "is_slang": {
          "type": "boolean",
          "description": "Whether the word is slang or non-standard"
        },
        "etymology": {
          "type": "string",
          "description": "Origin or etymology notes"
        },
        "definition": {
          "type": "string",
          "description": "Contextual definition within hip-hop culture"
        },
        "contexts": {
          "type": "array",
          "description": "Example usages from the corpus",
          "items": {
            "$ref": "#/$defs/Context"
          },
          "minItems": 1
        },
        "first_seen": {
          "type": "string",
          "description": "Earliest known usage (track or album)",
          "minLength": 1
        },
        "collocations": {
          "type": "array",
          "description": "Frequently co-occurring words",
          "items": {
            "$ref": "#/$defs/Collocation"
          }
        },
        "extensions": {
          "type": "object",
          "description": "Vendor-specific or experimental fields",
          "additionalProperties": true
        }
      }
    },
    "Context": {
      "type": "object",
      "description": "A usage context from the lyrics corpus",
      "required": ["line"],
      "additionalProperties": false,
      "properties": {
        "line": {
          "type": "string",
          "description": "The lyric line containing the word",
          "minLength": 1
        },
        "track": {
          "type": "string",
          "description": "Track/song title"
        },
        "album": {
          "type": "string",
          "description": "Album name"
        },
        "year": {
          "type": "integer",
          "description": "Release year",
          "minimum": 1,
          "maximum": 2200
        },
        "featuring": {
          "type": "array",
          "description": "Featured artists on this track",
          "items": {
            "type": "string"
          }
        },
        "timestamp": {
          "type": "string",
          "description": "Timestamp in track (MM:SS format)",
          "pattern": "^[0-9]{1,2}:[0-9]{2}$"
        }
      }
    },
    "Collocation": {
      "type": "object",
      "description": "A word that frequently appears with the grain word",
      "required": ["word", "score"],
      "additionalProperties": false,
      "properties": {
        "word": {
          "type": "string",
          "description": "The co-occurring word",
          "minLength": 1
        },
        "score": {
          "type": "number",
          "description": "Collocation strength score (0.0 to 1.0)",
          "minimum": 0,
          "maximum": 1
        },
        "position": {
          "type": "string",
          "description": "Typical position relative to grain word",
          "enum": ["before", "after", "either"]
        }
      }
    },
    "Bar": {
      "type": "object",
      "description": "A lyric bar entry with source, metrics, and semantic analysis",
      "required": ["text", "source"],
      "additionalProperties": false,
      "properties": {
        "text": {
          "type": "string",
          "description": "The lyric bar text",
          "minLength": 1
        },
        "source": {
          "$ref": "#/$defs/BarSource"
        },
        "metrics": {
          "$ref": "#/$defs/BarMetrics"
        },
        "semantics": {
          "$ref": "#/$defs/BarSemantics"
        },
        "language": {
          "type": "string",
          "description": "ISO 639-1 language code for this bar",
          "pattern": "^[a-z]{2}$"
        }
      }
    },
    "BarSource": {
      "type": "object",
      "description": "Source information for a bar",
      "required": ["track"],
      "additionalProperties": false,
      "properties": {
        "track": {
          "type": "string",
          "description": "Track/song title",
          "minLength": 1
        },
        "album": {
          "type": "string",
          "description": "Album name"
        },
        "year": {
          "type": "integer",
          "description": "Release year",
          "minimum": 1,
          "maximum": 2200
        },
        "featuring": {
          "type": "array",
          "description": "Featured artists on this track",
          "items": {
            "type": "string"
          }
        },
        "timestamp": {
          "type": "string",
          "description": "Timestamp in track (MM:SS format)",
          "pattern": "^[0-9]{1,2}:[0-9]{2}$"
        }
      }
    },
    "BarMetrics": {
      "type": "object",
      "description": "Quantitative metrics for a bar",
      "additionalProperties": false,
      "properties": {
        "syllable_count": {
          "type": "integer",
          "description": "Number of syllables",
          "minimum": 1
        },
        "word_count": {
          "type": "integer",
          "description": "Number of words",
          "minimum": 1
        },
        "rhyme_density": {
          "type": "number",
          "description": "Rhyme density score (0.0 to 1.0)",
          "minimum": 0,
          "maximum": 1
        }
      }
    },
    "BarSemantics": {
      "type": "object",
      "description": "Semantic analysis of a bar",
      "additionalProperties": false,
      "properties": {
        "mood": {
          "$ref": "#/$defs/Mood"
        },
        "themes": {
          "type": "array",
          "description": "Thematic tags",
          "items": {
            "type": "string",
            "minLength": 1
          },
          "uniqueItems": true
        },
        "techniques": {
          "type": "array",
          "description": "Lyrical techniques used (e.g., metaphor, simile, wordplay)",
          "items": {
            "type": "string",
            "minLength": 1
          },
          "uniqueItems": true
        }
      }
    },
    "Mood": {
      "type": "string",
      "description": "Mood classification",
      "enum": [
        "aggressive",
        "melancholic",
        "triumphant",
        "reflective",
        "humorous",
        "romantic",
        "defiant",
        "hopeful",
        "dark",
        "celebratory"
      ]
    }
  }
}
